{
  "schema": "combinatorial.swarmability.public.catalog.v1",
  "export_version": "2026-08-13.4",
  "source_binding": {
    "authority": "research-memory",
    "sha256": "238c1667da184e8a3d5b7ae783bcdd0d1205ed0c64b0e7b4ec3467438fdac7e0",
    "row_count": 26,
    "schema_sha256": "393344ead11abeaba854a80f08abc484c4f8ce6d983d5a4d058abca6b4e180a9",
    "profile_sha256": "40f6e9e586991c4ed4d9dad36aa80bf4ef6453c0f8bab7d58d0bb4ae28f09f00"
  },
  "items": [
    {
      "public_id": "scope-and-granularity",
      "display_order": 30,
      "title": "Address one robot a group or the whole swarm",
      "source": {
        "source_id": "cs-source-kim-et-al-2020-user-defined-swarm-control",
        "system_or_study": "Kim user-defined swarm control",
        "year": 2020,
        "paper_url": "https://doi.org/10.1145/3313831.3376814",
        "project_url": null,
        "artifact_url": "https://drl.ece.utah.edu/wp-content/uploads/sites/155/2021/07/kim-chi2020.pdf",
        "source_locus": "referents and elicited interaction set",
        "evidence_kind": "empirical-user-study",
        "literature_status": "evaluated-elicitation",
        "catalog_projection_status": "verified-projection",
        "checked_on": "2026-07-25"
      },
      "reported": {
        "input_expression": "gesture touch speech or combinations",
        "input_routes": "participant-defined multimodal expressions",
        "user_action": "select an individual group or whole swarm then indicate motion speed or scale",
        "semantic_action": "select and move at chosen granularity",
        "control_family": "exogenous-target-or-trajectory",
        "controlled_quantity": "group motion; speed; selection; formation scale",
        "parameter_exposure": "direct-semantic",
        "target_scope": "individual; group; whole swarm",
        "temporal_mode": "discrete and continuous elicited commands",
        "human_configuration": "single-user",
        "multi_user_combination": "no multi-user combination",
        "substrate": "robotic"
      },
      "reconstruction": {
        "status": "implemented-reconstruction",
        "summary": "Reconstruct target scope as a policy decision that remains separate from the physical input route.",
        "interaction": "toggle member group and all scopes then issue the same move or speed command",
        "effect": "identical semantic commands affect different population scopes",
        "semantic_actions": [
          "select_member",
          "set_scope",
          "set_collective_behavior",
          "adjust_preferred_speed"
        ],
        "transfer_boundary": "elicited mappings are contextual and do not establish an implemented universal vocabulary or ability-diverse usability",
        "does_not_claim": "This reconstruction does not reproduce the elicited gestures or establish a universal or ability-diverse interaction vocabulary."
      },
      "facets": {
        "input_routes": [
          "gesture",
          "touch",
          "speech",
          "multimodal"
        ],
        "control_families": [
          "exogenous-target-or-trajectory"
        ],
        "scopes": [
          "member",
          "subgroup",
          "swarm"
        ],
        "temporal_modes": [
          "discrete",
          "continuous"
        ],
        "multi_user_policies": [
          "single-user"
        ],
        "substrates": [
          "robotic"
        ],
        "evidence_statuses": [
          "evaluated-elicitation"
        ]
      }
    },
    {
      "public_id": "additive-personal-fields",
      "display_order": 70,
      "title": "Superimpose embodied gravity fields",
      "source": {
        "source_id": "cs-source-lee-2021-entangled",
        "system_or_study": "Entangled",
        "year": 2021,
        "paper_url": "https://doi.org/10.21428/92fbeb44.eae7c23f",
        "project_url": null,
        "artifact_url": null,
        "source_locus": "implementation and up-to-eight-player demonstration",
        "evidence_kind": "technical-demonstration",
        "literature_status": "implemented-demonstration",
        "catalog_projection_status": "verified-projection",
        "checked_on": "2026-07-25"
      },
      "reported": {
        "input_expression": "smartphone motion and spiral gesture through a web interface",
        "input_routes": "continuous device motion plus persistent gesture event",
        "user_action": "move the phone to exert gravity or draw a spiral to place a persistent point",
        "semantic_action": "apply gravitational attractor or repellent field",
        "control_family": "exogenous-environment-or-field",
        "controlled_quantity": "gravitational forces and persistent attractors or repellents",
        "parameter_exposure": "direct-semantic",
        "target_scope": "spatial field",
        "temporal_mode": "continuous and persistent runtime",
        "human_configuration": "multi-user",
        "multi_user_combination": "field superposition from up to eight players",
        "substrate": "digital"
      },
      "reconstruction": {
        "status": "implemented-reconstruction",
        "summary": "Reconstruct additive personal attractor and repellent fields while retaining contributor provenance.",
        "interaction": "drag or tilt a personal field source and click to leave persistent attractors or repellents",
        "effect": "particle trajectories bend under the additive fields and retain visible contributor colours",
        "semantic_actions": [
          "place_field",
          "move_field",
          "set_field_polarity",
          "remove_field"
        ],
        "transfer_boundary": "no statistical user study fairness accessibility agency or optimal overlap policy",
        "does_not_claim": "This reconstruction does not reproduce the original instrument or establish fairness, accessibility, agency, or an optimal overlap policy."
      },
      "facets": {
        "input_routes": [
          "device-motion",
          "gesture"
        ],
        "control_families": [
          "exogenous-environment-or-field"
        ],
        "scopes": [
          "field"
        ],
        "temporal_modes": [
          "continuous",
          "persistent"
        ],
        "multi_user_policies": [
          "superposition"
        ],
        "substrates": [
          "digital"
        ],
        "evidence_statuses": [
          "implemented-demonstration"
        ]
      }
    },
    {
      "public_id": "raw-dynamics-parameters",
      "display_order": 150,
      "title": "Adjust transition rates inside the swarm controller",
      "source": {
        "source_id": "cs-source-crandall-et-al-2017-human-swarm-shared-control",
        "system_or_study": "Crandall hub-based shared-control interface",
        "year": 2017,
        "paper_url": "https://doi.org/10.1007/978-3-319-58472-0_21",
        "project_url": null,
        "artifact_url": "https://faculty.cs.byu.edu/~crandall/papers/CrandallSwarmHCII2017.pdf",
        "source_locus": "Tables 2 and 4 and Section 4.2",
        "evidence_kind": "technical-demonstration",
        "literature_status": "described-technical-mechanism",
        "catalog_projection_status": "verified-projection",
        "checked_on": "2026-07-25"
      },
      "reported": {
        "input_expression": "hub-based parameter interface",
        "input_routes": "exact physical device not reported in the source note",
        "user_action": "adjust rates governing transitions among robot states",
        "semantic_action": "set endogenous controller rates",
        "control_family": "endogenous-dynamics",
        "controlled_quantity": "rates of transitions among robot states",
        "parameter_exposure": "direct-semantic",
        "target_scope": "global swarm",
        "temporal_mode": "continuous runtime",
        "human_configuration": "single-user",
        "multi_user_combination": "no multi-user combination",
        "substrate": "robotic"
      },
      "reconstruction": {
        "status": "implemented-reconstruction",
        "summary": "Reconstruct app-owned rates for entering Flock, Cohere, and Disperse modes, and expose their distribution and metrics as a technical analogy.",
        "interaction": "move labelled state-transition sliders while a state-flow diagram remains visible",
        "effect": "the proportions of agents occupying exploration task or other states change over time",
        "semantic_actions": [
          "set_alignment",
          "set_cohesion",
          "set_separation"
        ],
        "transfer_boundary": "technical plausibility only; no completed usability fairness or shared-authorship evaluation",
        "does_not_claim": "This reconstruction does not reproduce the source's exploration, task, or other robot-state model or instrument, and demonstrates technical parameter effects rather than evaluated usability, fairness, or shared authorship."
      },
      "facets": {
        "input_routes": [
          "parameter-interface"
        ],
        "control_families": [
          "endogenous-dynamics"
        ],
        "scopes": [
          "swarm"
        ],
        "temporal_modes": [
          "continuous"
        ],
        "multi_user_policies": [
          "single-user"
        ],
        "substrates": [
          "robotic"
        ],
        "evidence_statuses": [
          "described-technical-mechanism"
        ]
      }
    },
    {
      "public_id": "semantic-laban-dynamics",
      "display_order": 200,
      "title": "Translate Laban movement qualities into swarm dynamics",
      "source": {
        "source_id": "cs-source-gobec-et-al-2026-dancing-swarm",
        "system_or_study": "The Dancing Swarm",
        "year": 2026,
        "paper_url": "https://dl.acm.org/doi/10.1145/3776734.3794497",
        "project_url": "https://research.vu.nl/en/publications/the-dancing-swarm-using-laban-effort-parameters-for-generating-ex/",